{
  "decisions": [
    {
      "aliases": [
        "Q211"
      ],
      "answer_summary": "✔ ⚠ **Overridden — nothing is torched.** Verbatim answer opening this file. So:",
      "capability_id": null,
      "disposition": null,
      "id": "C11-Q211",
      "question_text": "— what \"the old shit does not matter\" covers",
      "review_state": "reviewed",
      "source_digest": "4627fe3e0a9bd9108edd553642f459b64774bf05efe1d7d8560c22122930baad",
      "source_file": "GRILLING-C11.md",
      "source_line": 51,
      "target_stage": null
    },
    {
      "aliases": [
        "Q212"
      ],
      "answer_summary": "✔ **(a) confirmed.** The claim is the one thing carried across.",
      "capability_id": null,
      "disposition": null,
      "id": "C11-Q212",
      "question_text": "— what the game is",
      "review_state": "reviewed",
      "source_digest": "4627fe3e0a9bd9108edd553642f459b64774bf05efe1d7d8560c22122930baad",
      "source_file": "GRILLING-C11.md",
      "source_line": 66,
      "target_stage": null
    },
    {
      "aliases": [
        "Q213"
      ],
      "answer_summary": "✔ ⚠ **Overridden — Rust with free crates.** Same language; any crate is on the",
      "capability_id": null,
      "disposition": null,
      "id": "C11-Q213",
      "question_text": "— the stack",
      "review_state": "reviewed",
      "source_digest": "4627fe3e0a9bd9108edd553642f459b64774bf05efe1d7d8560c22122930baad",
      "source_file": "GRILLING-C11.md",
      "source_line": 76,
      "target_stage": null
    },
    {
      "aliases": [
        "Q214"
      ],
      "answer_summary": "✔ **(c) confirmed.** Land, gather, make, survive; then the next stages are",
      "capability_id": null,
      "disposition": null,
      "id": "C11-Q214",
      "question_text": "— the finish line of \"an actual game\"",
      "review_state": "reviewed",
      "source_digest": "4627fe3e0a9bd9108edd553642f459b64774bf05efe1d7d8560c22122930baad",
      "source_file": "GRILLING-C11.md",
      "source_line": 87,
      "target_stage": null
    },
    {
      "aliases": [
        "Q215"
      ],
      "answer_summary": "✔ ⚠ **Overridden — short *and* records**: `DESIGN.md` plus per-stage decision",
      "capability_id": null,
      "disposition": null,
      "id": "C11-Q215",
      "question_text": "— where the new design lives",
      "review_state": "reviewed",
      "source_digest": "4627fe3e0a9bd9108edd553642f459b64774bf05efe1d7d8560c22122930baad",
      "source_file": "GRILLING-C11.md",
      "source_line": 95,
      "target_stage": null
    },
    {
      "aliases": [
        "Q216"
      ],
      "answer_summary": "✔ **(a) confirmed.** Done this session: #1 carries the record, #2–#11 close as",
      "capability_id": null,
      "disposition": null,
      "id": "C11-Q216",
      "question_text": "— the GitHub map (#1 and children #2–#11)",
      "review_state": "reviewed",
      "source_digest": "4627fe3e0a9bd9108edd553642f459b64774bf05efe1d7d8560c22122930baad",
      "source_file": "GRILLING-C11.md",
      "source_line": 102,
      "target_stage": null
    },
    {
      "aliases": [
        "Q217"
      ],
      "answer_summary": "✔ **A confirmed.** Deterministic replay, conservation, retirement rather than",
      "capability_id": null,
      "disposition": null,
      "id": "C11-Q217",
      "question_text": "— which principles are immutable",
      "review_state": "reviewed",
      "source_digest": "4627fe3e0a9bd9108edd553642f459b64774bf05efe1d7d8560c22122930baad",
      "source_file": "GRILLING-C11.md",
      "source_line": 118,
      "target_stage": null
    },
    {
      "aliases": [
        "Q218"
      ],
      "answer_summary": "✔ ⚠ **D overridden — the whole game redesign comes first.** Every gameplay system",
      "capability_id": null,
      "disposition": null,
      "id": "C11-Q218",
      "question_text": "— what must be redesigned before playable product work",
      "review_state": "reviewed",
      "source_digest": "4627fe3e0a9bd9108edd553642f459b64774bf05efe1d7d8560c22122930baad",
      "source_file": "GRILLING-C11.md",
      "source_line": 135,
      "target_stage": null
    },
    {
      "aliases": [
        "Q219"
      ],
      "answer_summary": "✔ **Domain-first, internal layers confirmed.** A domain owns its behavior and",
      "capability_id": null,
      "disposition": null,
      "id": "C11-Q219",
      "question_text": "— how domain, technical layers, and crates relate",
      "review_state": "reviewed",
      "source_digest": "4627fe3e0a9bd9108edd553642f459b64774bf05efe1d7d8560c22122930baad",
      "source_file": "GRILLING-C11.md",
      "source_line": 148,
      "target_stage": null
    },
    {
      "aliases": [
        "Q220"
      ],
      "answer_summary": "✔ **A confirmed.** The standard library and established crates are free to be used.",
      "capability_id": null,
      "disposition": null,
      "id": "C11-Q220",
      "question_text": "— what replaces the hand-rolled-wheels rule",
      "review_state": "reviewed",
      "source_digest": "4627fe3e0a9bd9108edd553642f459b64774bf05efe1d7d8560c22122930baad",
      "source_file": "GRILLING-C11.md",
      "source_line": 162,
      "target_stage": null
    },
    {
      "aliases": [
        "Q221"
      ],
      "answer_summary": "✔ **A+C confirmed, with two explicit answers.**",
      "capability_id": null,
      "disposition": null,
      "id": "C11-Q221",
      "question_text": "— what makes a stage pass",
      "review_state": "reviewed",
      "source_digest": "4627fe3e0a9bd9108edd553642f459b64774bf05efe1d7d8560c22122930baad",
      "source_file": "GRILLING-C11.md",
      "source_line": 177,
      "target_stage": null
    },
    {
      "aliases": [
        "Q222"
      ],
      "answer_summary": "✔ **A confirmed.**",
      "capability_id": null,
      "disposition": null,
      "id": "C11-Q222",
      "question_text": "— where each kind of truth is stored",
      "review_state": "reviewed",
      "source_digest": "4627fe3e0a9bd9108edd553642f459b64774bf05efe1d7d8560c22122930baad",
      "source_file": "GRILLING-C11.md",
      "source_line": 201,
      "target_stage": null
    },
    {
      "aliases": [
        "Q223"
      ],
      "answer_summary": "✔ **A confirmed.** Two runs are equivalent when their canonical domain projections",
      "capability_id": null,
      "disposition": null,
      "id": "C11-Q223",
      "question_text": "— what makes replayed worlds semantically equivalent",
      "review_state": "reviewed",
      "source_digest": "4627fe3e0a9bd9108edd553642f459b64774bf05efe1d7d8560c22122930baad",
      "source_file": "GRILLING-C11.md",
      "source_line": 224,
      "target_stage": null
    },
    {
      "aliases": [
        "Q224"
      ],
      "answer_summary": "✔ **A confirmed.** The census covers gameplay, simulation, content declarations,",
      "capability_id": null,
      "disposition": null,
      "id": "C11-Q224",
      "question_text": "— what census defines the whole-game scope",
      "review_state": "reviewed",
      "source_digest": "4627fe3e0a9bd9108edd553642f459b64774bf05efe1d7d8560c22122930baad",
      "source_file": "GRILLING-C11.md",
      "source_line": 241,
      "target_stage": null
    },
    {
      "aliases": [
        "Q225"
      ],
      "answer_summary": "✔ **A confirmed.** Q218 is narrowed, not reversed. The **whole-game design",
      "capability_id": null,
      "disposition": null,
      "id": "C11-Q225",
      "question_text": "— what “whole game first” requires before Stage 1",
      "review_state": "reviewed",
      "source_digest": "4627fe3e0a9bd9108edd553642f459b64774bf05efe1d7d8560c22122930baad",
      "source_file": "GRILLING-C11.md",
      "source_line": 254,
      "target_stage": null
    },
    {
      "aliases": [
        "Q226"
      ],
      "answer_summary": "✔ **A confirmed.** A parallel executable specification, model, or probe may be",
      "capability_id": null,
      "disposition": null,
      "id": "C11-Q226",
      "question_text": "— how parallel work coexists with rework in place",
      "review_state": "reviewed",
      "source_digest": "4627fe3e0a9bd9108edd553642f459b64774bf05efe1d7d8560c22122930baad",
      "source_file": "GRILLING-C11.md",
      "source_line": 269,
      "target_stage": null
    },
    {
      "aliases": [
        "Q227"
      ],
      "answer_summary": "✔ **A confirmed.** Capabilities are re-grilled breadth-first along the frontier",
      "capability_id": null,
      "disposition": null,
      "id": "C11-Q227",
      "question_text": "— in what order the inherited questions return",
      "review_state": "reviewed",
      "source_digest": "4627fe3e0a9bd9108edd553642f459b64774bf05efe1d7d8560c22122930baad",
      "source_file": "GRILLING-C11.md",
      "source_line": 284,
      "target_stage": null
    },
    {
      "aliases": [
        "Q228"
      ],
      "answer_summary": "✔ **A confirmed.** Every inherited save, season record, schema, manifest, review",
      "capability_id": null,
      "disposition": null,
      "id": "C11-Q228",
      "question_text": "— what compatibility burden inherited artifacts carry",
      "review_state": "reviewed",
      "source_digest": "4627fe3e0a9bd9108edd553642f459b64774bf05efe1d7d8560c22122930baad",
      "source_file": "GRILLING-C11.md",
      "source_line": 300,
      "target_stage": null
    },
    {
      "aliases": [
        "Q229"
      ],
      "answer_summary": "✔ **Campaign-scoped IDs confirmed.** C1–C10 use dense per-campaign canonical IDs",
      "capability_id": null,
      "disposition": null,
      "id": "C11-Q229",
      "question_text": "— what identity every inherited decision carries",
      "review_state": "reviewed",
      "source_digest": "4627fe3e0a9bd9108edd553642f459b64774bf05efe1d7d8560c22122930baad",
      "source_file": "GRILLING-C11.md",
      "source_line": 315,
      "target_stage": null
    },
    {
      "aliases": [
        "Q230"
      ],